{
  "schema_version": "1.0",
  "brief": {
    "schema_version": "1.0",
    "product_id": "new-asset-studio",
    "name": "Asset Studio",
    "category": "desktop",
    "concept": "一款面向独立游戏团队的全新资产管理应用，集中管理贴图、模型和音频，并支持标签筛选",
    "requirements": [
      {
        "id": "REQ-001",
        "text": "一款面向独立游戏团队的全新资产管理应用，集中管理贴图、模型和音频，并支持标签筛选",
        "source": "user-prompt",
        "authority": "source-stated",
        "use_case_ids": []
      },
      {
        "id": "REQ-002",
        "text": "用户按类型和标签筛选游戏资产，选择素材查看详情",
        "source": "user-prompt",
        "authority": "source-stated",
        "use_case_ids": [
          "UC-001"
        ]
      }
    ],
    "hard_constraints": [],
    "use_cases": [
      {
        "id": "UC-001",
        "title": "用户按类型和标签筛选游戏资产，选择素材查看详情",
        "actor": "unspecified",
        "goal": "用户按类型和标签筛选游戏资产，选择素材查看详情",
        "steps": [
          {
            "id": "STEP-001",
            "action": "用户按类型和标签筛选游戏资产，选择素材查看详情",
            "state": "in-progress",
            "flow": "main",
            "ui_text": [],
            "visible_evidence": []
          }
        ]
      }
    ],
    "unknowns": [
      "actor",
      "interaction design",
      "UI layout",
      "visual style",
      "visible feedback"
    ],
    "origin": {
      "mode": "direct-prompt",
      "source_id": "CLI:brief-init"
    }
  },
  "decisions": [],
  "scenes": [
    {
      "schema_version": "1.0",
      "id": "new-asset-studio--UC-001--STEP-001",
      "product_id": "new-asset-studio",
      "use_case_id": "UC-001",
      "step_id": "STEP-001",
      "action": "用户按类型和标签筛选游戏资产，选择素材查看详情",
      "state": "in-progress",
      "flow": "main",
      "frame_scope": "software-only",
      "viewpoint_mode": "application-ui",
      "design_status": "unresolved",
      "requirement_ids": [
        "REQ-001",
        "REQ-002"
      ],
      "design_decision_ids": [],
      "visible_evidence": [],
      "expected_ui_text": [],
      "proposed_elements": []
    }
  ]
}
